,标题,热度
0,东风快递征兵宣传片,0
1,郑恺发文回忆跑男100期,2621939
2,美国新冠肺炎确诊超491万例,2016960
3,Pick静静子出道,1937557
4,邓超送白玉兰花安慰孙俪,1549882
5,黄晓明安慰赵丽颖,1299311
6,八月必须发发发,1196370
7,印度客机滑出跑道断成两截,1133277
8,二十不惑大结局,694402
9,腾讯回应特朗普微信交易禁令,565307
10,C罗梅开二度,492948
11,闫妮白玉兰最佳女主角,482445
12,男友杀害南京女生作案动机,451118
13,北京奥运12年,402999
14,这辈子都不会忘的尴尬场面,293545
15,两座北极冰盖因全球变暖消失,291837
16,梁爽赵优秀在一起,290891
17,余承东称华为手机没芯片了,290059
18,成毅打戏,289544
19,武汉欢乐谷,287244
20,老人连续7年拍摄天空,269991
21,任嘉伦吃播,267281
22,明日之子官方锤瓜,260787
23,尤文皇马被淘汰,225727
24,黎巴嫩大爆炸后再爆发抗议示威,206538
25,记者测评4款清凉口罩全部不合格,198904
26,李子柒秋风送葵,198479
27,陈宝国白玉兰最佳男主角,198260
28,中餐厅,196138
29,奔跑吧,180908
30,外交部回应中加关系遭遇困难,177902
31,杨幂跳无价之姐,175649
32,500强企业工程师回乡种番茄,159075
33,宁静李斯丹妮抢王霏霏,158869
34,时代周刊封面新冠病毒水淹白宫,157009
35,杨洁篪谈中美关系,156721
36,秦海璐黑色高开衩长裙,156487
37,刘诗诗刘昊然合体大片,150011
38,郭艾伦手势,139130
39,四川安岳杀妻嫌疑人被批捕,137605
40,欧冠,131517
41,海涛把吴昕鼓励哭了,127874
42,奢侈品手写师用牙刷写字,122519
43,响水爆炸案15名公职人员被诉,116634
44,北航录取通知书上有个小飞机,106040
45,原来生日也可以有颜色,102790
46,周琦抢篮板,95947
47,鞠婧祎 谢谢善良的人,90863
48,平均年龄68岁的体操队,84054
49,琉璃,75348
50,微信,54873
