,标题,热度
0,高分九号05星发射成功,0
1,周冬雨同学发声,4803334
2,菲律宾发生爆炸,3116561
3,易烊千玺无懈可击,2939258
4,罗晋父子首次同台,2624050
5,欧阳娜娜泳装,2482884
6,iPhone12,1375231
7,福州大学回应准研究生疑虐狗,726927
8,新员工不喝领导敬酒被打耳光,616508
9,武大女生回武汉看到人山人海想哭,608626
10,于小彤陈小纭分手,579787
11,黄之锋遛狗被大妈痛骂,501446
12,银行回应新员工不喝酒被打耳光,346184
13,北京天空七彩祥云,336768
14,央视关注老人未扫健康码乘车受阻,312215
15,吉杰为郑爽发声,306546
16,张鑫口才,287399
17,全国本科院校18年来新增37799个专业,286864
18,跟嘴巴商量好了再唱,284808
19,美企被允许在中国用微信,281827
20,宋威龙,278499
21,七夕文案,277629
22,安倍晋三又进医院,274609
23,沈阳暴雨,272796
24,离家出走女生安慰走丢萌娃,268031
25,杨幂粉色挑染马尾,262002
26,邓伦粉丝脱粉,261647
27,糖豆人,249193
28,贺子秋我再也不走了,236009
29,义务教育阶段班主任减负愿望强烈,226525
30,周冬雨唐培彦,223699
31,张新成复古雅致大片,222599
32,白俄罗斯首都大规模抗议活动,220753
33,追星女孩的温度差,211425
34,卢卡申科手持突击步枪前往总统府,175771
35,孟美岐黑唇封面,175119
36,没有PS时期的演员,172793
37,花木兰日本不上院线,164258
38,官方回应驴友挑战贵州网红瀑布,163793
39,七夕浪漫莓子妆,160223
40,王俊凯出演电影731,158837
41,铁骑小姐姐帮受伤外卖小哥送外卖,155621
42,如何应对酒桌文化,151431
43,KC JD,151274
44,救人未成功遭恶评医学生回应,151183
45,长辈来家里该不该先打招呼,151176
46,特朗普紧急授权恢复期血浆治疗新冠,151172
47,七夕表白创意,150231
48,基金,144587
49,倒霉蛋玩游戏是什么样,143776
50,多地用纸质健康证明代替健康码,142853
