,标题,热度
0,中国科学家的奋斗宣言,0
1,孙俪 妹妹上了课回来教教我,3975923
2,浙江岱山一外籍轮船7名船员核酸阳性,2586346
3,张纪中承认再婚,1988840
4,王梓薇,1764035
5,一次喝3.2L水致水中毒,1161076
6,如何晒后返白,1001377
7,笑起来真好看课间操完整视频,963916
8,牛津新冠疫苗第三期测试重新恢复,874258
9,加拿大下周开始对美征收36亿报复性关税,857893
10,长泽雅美中川雅也约会,851353
11,阿娇拆绷带后首露面,677116
12,特朗普获今年第二个诺贝尔和平奖提名,676490
13,多本爆特朗普黑料新书销量猛增,658682
14,美国新冠阳性学生举办大型派对,648856
15,日本网暴施暴者个人信息可公开,633460
16,美国遭遇毁灭性山火季,616398
17,76岁老人救起200多斤溺水者,610079
18,美网2020,590504
19,湖人时隔十年再进西决,579250
20,Jennie跳Ice Cream,561124
21,张萌明日之子后台vlog,557473
22,夺冠提档,538545
23,少年3岁半上二年级13岁高考,536905
24,美国加州两名警察遭枪击,498131
25,逃犯自首求先领证结婚,461127
26,高速爆胎司机教科书式处理故障,442347
27,李汶翰后援会官博发文,392383
28,威少与隆多哥哥冲突,387509
29,侵犯知识产权犯罪入罪门槛降至30万,386785
30,朴树 以后不会再当老师了,386749
31,女生寝室可以多有趣,362500
32,狗狗最爱听哪个字,329745
33,去学校的车有点奇怪,255177
34,国防部回应美发布中国军事报告,249140
35,小说里霸道总裁如何上厕所,248926
36,浓郁椰子鸡,234885
37,这就是我没对象的真实原因,202225
38,重启第二季开播,199311
39,男生寝室可以有多沙雕,193135
40,药水哥放弃新说唱复活,180337
41,伏地魔没有鼻子的原因,163002
42,李胜利,155552
43,广东海警查获12名非法越境人员,147491
44,钟汉良为什么淘汰肖杰,145784
45,各专业的上课日常,144606
46,王源双面封面,137715
47,喂狗吃辣子鸡博主回应,111785
48,中老铁路友谊隧道贯通,109816
49,湖人球迷观众席晒科比照片,109457
50,厨师处理猪肉受伤感染罕见脑膜炎,108880
