,标题,热度
0,铁路国庆黄金周启动,0
1,傅园慧预赛第一无缘决赛,2783584
2,贵州杀妻灭子案发回重审,1469395
3,纯电动还是保时捷吗,1465348
4,李易峰好像穿了双高跟鞋,1388452
5,李沁露背诗画造型,1067877
6,N1,957292
7,亚洲小姐十强诞生,913160
8,90后小伙免费为数千农村老人剪发,913130
9,美媒称特朗普10年没缴纳所得税,899585
10,如懿传下架,878450
11,延禧攻略下架,873586
12,白浪是郎平女儿,859821
13,民警用秋天的第一杯奶茶救下轻生女孩,846194
14,钟南山寄语南山班医科学子,829274
15,打个麻将顺便健了身,817518
16,3岁翻版福原爱哭着打乒乓球,803516
17,体育总局,797943
18,黄潇,682203
19,警方通报安徽界首一家四人死亡案件,613584
20,有一种辣叫广东辣,602471
21,吴亦凡想尝试透明裤子,556529
22,甄嬛传挺住,464892
23,我们恋爱吧定档,439354
24,消防队里专捅马蜂窝的人,424331
25,沈昌珉10月25日举行婚礼,417519
26,印军向边境大量运送战备补给,409388
27,伊能静儿子再晒女装照,358278
28,螺蛳粉冰皮月饼,316903
29,外交部提醒假期避免非必要跨境旅行,309901
30,这就是街舞复活榜,307408
31,郑爽蝴蝶结耳饰,275244
32,黄鸿升女友回应被指蹭热度,266557
33,原来麻球可以这大颗,245618
34,阿塞拜疆总统宣布国家进入战争状态,242710
35,JUNJIN婚礼,242240
36,尴尬又不失礼貌的批评方法,241753
37,做肺部检查有多难,238473
38,深圳公交新增电动伸缩踏板,236551
39,派大星简直是个魔鬼,211404
40,周震南的表情就是我本人,210157
41,这一代年轻人压力真的更小吗,205323
42,明年金像奖将延后一年,204429
43,中国队蝉联2020国际奥数赛第一,204132
44,库里祝贺伊戈达拉晋级总决赛,203034
45,阿尔卑斯山脚下遛狗也太惬意了,202546
46,早餐自提柜成上班族新宠,201691
47,中国企业500强榜单,197833
48,巩俐 赞美喷子全接受,196332
49,故宫每一片瓦都有编码,185932
50,体能决定运动员赛事成绩合理吗,185216
