,标题,热度
0,四川洪水中最温暖的大手,0
1,考生伪造清华录取通知书,3215338
2,23年前被分配工作至今未等到通知,2050161
3,龟梨和也道歉,1459262
4,with,1327246
5,摸狗狗时突然停止,1075226
6,迈出去自然不同,1045387
7,一中国男子东京街头遭绑架,994580
8,马鞍山,974683
9,今年报考医学专业的人更多了,968200
10,最让人心疼浙江女护士想回武汉,965137
11,何洛洛方回应新歌涉抄袭,874732
12,左脚变形坚持跳舞女孩去看医生了,706736
13,央视七夕晚会首波阵容,646089
14,吴尊友谈今年秋冬疫情形势,587731
15,赵薇湿发,580420
16,何洛洛新歌制作人否认抄袭,569110
17,世界首富贝索斯身价近2000亿美元,565542
18,中学提供三档伙食费被质疑存攀比,544220
19,落水女子踩木头漂流一夜后获救,531204
20,牛奶咖啡 好好做人,526575
21,王岳伦表白李湘王诗龄,521199
22,原来多米诺骨牌不是手摆的,457633
23,一猫两人三餐四季的生活,393256
24,特朗普再次反对邮寄选票,380735
25,成都彩虹,371186
26,虞书欣半膝红靴,368743
27,白色月光,365603
28,华为发布会,352628
29,东京103人中暑死亡,346744
30,无法成为网红的真实原因,345205
31,金晨港风复古大片,330223
32,无实物吃播,305211
33,无价之医,292289
34,香港将向世贸组织申诉,284710
35,北京晚霞,277748
36,小时代抓马情节回顾,254245
37,人类早期驯服披萨的视频,247217
38,德云社团建,239893
39,中国参加武器贸易条约缔约国大会,222389
40,女超重启,220605
41,赵丽颖慵懒风大片,218878
42,杨幂苹果衬衫,216169
43,邓伦人形支柱,203807
44,乐山大佛脚趾露出,191037
45,江苏这类患儿可申请免费人工耳蜗,188414
46,重庆轨道2号线变水上列车,186333
47,别用衣架晾口罩,182226
48,东部战区回应美国驱逐舰穿航台湾海峡,175931
49,成都 雪山城市,172923
50,洪水涌入重庆喜来登酒店大堂,172307
