,标题,热度
0,将抑郁症筛查纳入高中及高校学生体检,0
1,张靓颖 那个说小三的给我滚出去,4144457
2,超一本线108分的脑瘫少年开学报到,3351777
3,杨幂生日微博评论,3059537
4,张国荣,2079648
5,突然喊老公的全名,1227867
6,姚晨 光芒全开,1035818
7,东北男子跳绳半年痩50斤拿世界亚军,890938
8,中方要求美国不要干涉中国内政,622628
9,教师资格证,604772
10,鹿晗发际线,574390
11,贾跃亭被终身禁入证券市场,533833
12,到2022年抑郁症就诊率提升50%,527770
13,村支书雇凶撞死举报者获死刑,488791
14,还没从琉璃走出来,449455
15,迪丽热巴为杨幂庆生,445913
16,南京遇害女学生父亲最新发声,418130
17,全班男生给唯一女生过生日,412643
18,7位摄影师在故宫拍摄近63万件文物,397320
19,闽南师范大学,382187
20,迪丽热巴用蔡徐坤表情包,380278
21,猫先拿回来 手机可以慢慢等,362601
22,幼儿园萌娃大佬坐姿看其他孩子哭,334304
23,不耐受十四项,330789
24,发帖女生回应高校强制男女混住,295859
25,王以太结婚,292741
26,赵丽颖 幼儿园园长,288963
27,学生疑遭体罚后死亡涉事教师已停课,276359
28,护考,266718
29,王毅称中国从不干涉美国内政,262814
30,唐鹤德为张国荣庆冥寿,253503
31,我的现男友也是我的前伴郎,243906
32,抑郁症成仅次于癌症的人类第二大杀手,235850
33,有些人天生被淘汰但他们已经赢了,227937
34,中俄发布外交部长联合声明,222656
35,唐嫣入选青年文艺家培养计划,221075
36,腰痛自我缓解指南,219422
37,蔡明配音十七岁少女,196511
38,台湾的谐音梗,157224
39,第一次见这么温柔的篮球板,149963
40,小青龙拒绝复活GAI扔链子,146236
41,一生一世剧组向任嘉伦道歉,137874
42,村民合力拉布接住坠楼女童,122860
43,中餐厅,118800
44,掘金逆转快船,114706
45,反黑路人甲,107759
46,幼儿园男孩扶女生睡觉,103516
47,臭豆腐烤冷面,101297
48,小伙用订书钉搭建微型重庆城,98552
49,如何拯救花这个姓氏,93688
50,周梓倩对吴亦凡撒娇,92870
