,标题,热度
0,高分七号卫星正式投入使用,0
1,郑爽说太早懂事不是幸福,2524103
2,伪造清华录取书学生已找到,1574716
3,段奕宏带你一起奔富,1561948
4,牛奶咖啡微博评论,1525608
5,我对象说七夕陪我一天,1226222
6,涂松岩回应以家人之名争议,858541
7,家属不追责老人被狗绳绊倒身亡,699855
8,美媒称美中会谈将于未来几天举行,457402
9,椰树要求应聘者抵押房产终身服务,455756
10,四川乐山通报疑似化工厂泄漏,455512
11,Angelababy哭戏,445265
12,见过最反人类的设计,427440
13,李尖尖给树洞投稿,422835
14,上海退役4年导盲犬苦等领养,409935
15,美国打算恢复对伊朗制裁,399007
16,恶之花,385926
17,瑞幸咖啡单店现金流已转正,385294
18,哈里斯被提名为民主党副总统候选人,385239
19,椰树回应招聘要求抵押房产终身服务,384959
20,淘宝多名卖家制售假录取通知书,384884
21,葛优再演张北京,384603
22,牛奶咖啡晒音轨对比,384489
23,四川观察,384425
24,男子酒后打赌跳江后无力回游,383471
25,舒克贝塔,382658
26,看黄明昊郭麒麟喝交杯酒的杨幂,360943
27,菠萝芥末油条虾,310905
28,向四川等地拨付4.6亿元中央救灾资金,279827
29,成都公积金年底实现按月提取,266071
30,罗霈颖遗产由母亲继承,261423
31,日本人玩碰碰车,258630
32,许佳琪喻言再跳lion,236986
33,陶虹谈被当作过气女演员,216945
34,摄影师驾车穿越加州野火,205919
35,美国加州72小时内遭上万次雷击,202125
36,黑神话,194756
37,五通桥,191371
38,古天乐,166788
39,四川乐山五通桥区异味浓雾,160447
40,草莓奶油魔法棒,154689
41,广东陆丰南塘镇上调为中风险,147689
42,成毅破碎感,146251
43,商务部回应中美商定将于近日举行通话,140185
44,女孩洪水中救出男友心爱的高达,136664
45,宋佳刘敏涛光影大片,134193
46,薛之谦新歌不爱我,131340
47,小i机器人称向苹果索赔百亿偏低,116342
48,张家界天门山云海,115800
49,7旬奶奶用旧衣改造时装,110018
50,苹果公司市值突破两万亿美元,109527
