,标题,热度
0,西藏摸清150多种陆生野生动物资源,0
1,赵露思道歉,3642393
2,卖假货主播年收入上千万,956126
3,2020最带敢的事,956006
4,谭松韵端水大师,944072
5,宋茜泳装照,937633
6,跟着LANVIN浪一浪,933023
7,中国驻印度使馆发表严正声明,891529
8,广州花都已检测116121人均为阴性,793065
9,板蓝根,661443
10,注会,562178
11,赵露思点赞,556905
12,猫咪为救幼童打败大狗,488263
13,日本政府拟将福岛核污水排入海中,437159
14,金鹰女神气质,394911
15,人类幼崽的快乐行为,391317
16,金鹰女神宣传片没有李小璐,388110
17,国家能源局副局长刘宝华被查,384513
18,原来狗和老虎就差一个栏杆,381120
19,新生军训书记大秀霹雳舞,373885
20,河南师范大学开设恋爱课,370248
21,宋威龙删博,363624
22,奶奶把气质拿捏得死死的,359979
23,眼科医生去世捐出眼角膜,352970
24,不靠糖的甜品才显本事,346456
25,兰州布病事件阳性居民发声,346436
26,赵丽颖 我已经很心平气和了,338165
27,宋茜的礼服显胖,330183
28,那些演技曾被低估的演员,293804
29,法国巴黎一老师被斩首,277123
30,税法,246845
31,周也生图好绝,245654
32,罗晋肤色,244782
33,当正主读自己的同人文,241126
34,希望能有一个大佬看出我的脆弱,240196
35,日本首相菅义伟向靖国神社献祭品,231773
36,TFBOYS给时代少年团打call,231707
37,车澈回应GALI现场diss节目组,230798
38,女孩子从小就可以很甜,228911
39,天涯明月刀,212391
40,男子提供直播流量造假服务被罚50万,196833
41,交警紧急吹哨救下处在货车盲区母女,168095
42,轿车被人从高空射箭穿透两层钢板,152128
43,如何不花流量看剧,146812
44,王者限定皮肤返场投票,139336
45,辽宁一小学疑多名学生食物中毒,137721
46,冤家聚头的甜怼CP,133117
47,浙江新冠疫苗重点人群优先接种,129314
48,邓伦郭艾伦三分大战,128302
49,金子涵体脂,127798
50,美国2020财年预算赤字达3.1万亿美元,127496
