,标题,热度
0,三部门发布正当防卫适用意见,0
1,郑爽 我在给自己一个任性的过程,2494408
2,湖南女生把滞留外地的武汉女孩接到家,998532
3,吴亦凡的真实肤质,997875
4,乘风破浪的姐姐 男嘉宾,995069
5,罗志祥ins点赞,873225
6,薛之谦,812585
7,教官回应女生军训被蜜蜂爬脸,700735
8,印巴交火一名印度军官死亡,634873
9,抠门退休教师捐出100多万用于教育,570390
10,北京连续四天出现彩虹,568422
11,陈赫,561198
12,政府将负责遭性侵女童全部费用,552065
13,上上谦火锅餐饮具检出大肠菌群,549921
14,华春莹称美国反华势力已丧失理性,542843
15,斯坦李在天堂门口迎接黑豹动画,538069
16,黄正音申请离婚,527590
17,护士等3年成功捐献造血干细胞,527378
18,自如回应租户喝中水,502983
19,日本细菌战部队二战唯一影像,486326
20,偷拍女生发表低俗言论获刑,484461
21,成龙北京两套豪宅将被拍卖,467365
22,王者荣耀,441783
23,印度或将有三成餐厅倒闭,428495
24,我国每学期用掉超19.4亿张塑料书皮,409163
25,原来鹿真是这么打架的,395309
26,杨幂蓝色油画大片,392335
27,张艺兴 嘲笑我可以不要嘲笑努力,392326
28,兵哥哥退伍后向女友报到,389157
29,一批高校调整秋季教学时间安排,319086
30,美方官员视中国留学生为间谍是妄想症,307568
31,乃万 不管谁的错都得我被骂,293108
32,宋芳园,286879
33,和平精英,269615
34,父母说为你好是道德绑架吗,250746
35,海豹原来是这样睡觉的,249675
36,宁静粉丝戴哪吒面具应援,231430
37,孟佳王霏霏 我们加油,228556
38,假如能够重返大一,207508
39,Show me love,203502
40,当男生尝到化妆的甜头,199645
41,虞书欣复古大片,195932
42,黑凤梨白椰汁冻糕,182431
43,阴阳师,162957
44,学校回应教官手抓学生剩饭吃掉,162756
45,英超与中国转播商解约,160978
46,第三批国家级抗战纪念设施遗址名录,158230
47,要求学生自带床板校长被停职,157831
48,特朗普借老兵diss拜登,155506
49,军训教官手抓学生剩饭当场吃掉,154829
50,非日常派对,154573
