,标题,热度
0,中国森林消防员最新招录宣传片,0
1,中餐厅向赵丽颖道歉,2899645
2,外交部副部长约见捷克驻华大使,1465278
3,限时惊喜75折起,1269725
4,谭松韵庭审现场哽咽发言,1245555
5,代入感太强已经住进别墅,1022868
6,李湘王岳伦律师声明,884055
7,九月,655638
8,西部战区就中印边境局势发表谈话,654061
9,学校不得强制或暗示购买指定资料,653943
10,紫禁城建成600年大展,652061
11,北京彩虹,650127
12,北京火烧云与彩虹同框,647877
13,甜仇发文,646392
14,疫情致印度童婚事件显著增加,645053
15,劳荣枝被提起公诉,642871
16,iPhone12,641377
17,陈婷太吓人了,639763
18,iPhone11浸泡8个月后仍可正常运行,637791
19,在线旅游网站不得大数据杀熟,636716
20,麦当劳汉堡薯条藏于鞋盒24年不坏,635079
21,谭松韵后援会,632710
22,玉林车站拉客女子已被约谈处罚,632198
23,雀斑女生有多好看,619038
24,游客疑似给动物喂口罩被制止,616298
25,小青龙淘汰,616009
26,李尖尖哄凌霄睡觉,502934
27,谭松韵妈妈被撞案肇事者否认吸毒,452365
28,董明珠回应格力半年报业绩下滑,381786
29,进京邮件快递9月初将二次安检,379384
30,李湘力挺王岳伦,379092
31,乐视起诉范冰冰及旗下公司,373012
32,张起淮,363389
33,不快乐也别焦虑,316783
34,小S古早风大片,257443
35,养猫的人上厕所不会孤独,238102
36,摩天大楼,200112
37,陆柯燃暂时缺席THE9团体活动,199430
38,朴宝剑正式入伍,187044
39,当小说里的帅哥变成现实,186022
40,华为提前解除与澳洲球队赞助合约,160939
41,影视剧里的名人名言,158974
42,有天赋是什么体验,151991
43,乘风破浪的姐姐水墨画海报,145711
44,未经用户同意不得发送商业短信,144785
45,开学第一课,140474
46,北京晚霞,138582
47,以家人之名,115301
48,儿子报警称被父亲用摄像头监控,77143
49,黎巴嫩总统任命新总理,74087
50,开学,73595
