,标题,热度
0,奋斗者号在马里亚纳海沟成功坐底,0
1,居里夫人笔记仍具放射性,2731176
2,确诊病例从1到1000万美国经历了什么,1570959
3,小李子身材,1549961
4,金贝贝,1526416
5,双十一晚会节目单,1451204
6,中国首届财经视频大赛,1179620
7,吴尊汪东城为辰亦儒庆生,1159178
8,青岛假睫毛订单量增加四成,1085217
9,外交部回应巴西暂停对中国疫苗的实验,1066527
10,李佳琦直播,1047992
11,应采儿告诉Jasper一定要学中文,763089
12,薇娅直播,523622
13,GAI不想让王斯然生二胎,518414
14,长沙一交警违规销分6年受贿超千万,512217
15,黄明昊,508004
16,A站未经授权播放喜羊羊被判赔6万元,491573
17,郑州的学生有多幸福,483657
18,兰州一小吃店包麻将汤圆,483450
19,亚美尼亚,475616
20,格德斯愿意入籍中国,453021
21,原来长得好看也会被拒绝,445406
22,小鸟比耶,396557
23,刘亦菲单手做平板支撑,360241
24,男子地铁突发癫痫车里恰巧有5名医生,325198
25,双十一狂欢夜,325083
26,韩国首个AI女主播金柱夏诞生,319880
27,明星考驾照有多好笑,296978
28,警方通报15岁少年遭围殴致死掩埋,283778
29,严格管控国内中高风险地区人员进京,280898
30,付家纸递,278840
31,顶楼,275281
32,王斯然 周延和GAI是两个人,270987
33,宇航员在太空中怎么洗头,259706
34,拜登呼吁美民众戴口罩,255406
35,15岁少年被围殴致死嫌犯父亲发声,252585
36,湖南卫视超拼夜,252529
37,万茜工作室退还粉丝集资应援款,244258
38,为录视频拍打千年银杏树,242102
39,京东阿里双十一商标权纠纷案,213607
40,2035你的一天可能这样度过,198140
41,邓超陪等等上篮球课,194358
42,老师为100分试卷设计隐藏彩蛋,172621
43,天津1例无症状感染者系冷链搬运工,172438
44,双十一商标该归谁,172273
45,天津排查发现3份弱阳性样品复检阴性,172123
46,高校为学生发防流感中药包,171947
47,双十一付尾款时的错觉,171845
48,蛋壳公寓回应拖欠供应商货款,165495
49,虎牙被抬员工回应简历造假,163180
50,周锐,162799
