,标题,热度
0,致敬擦亮山城的人,0
1,以家人之名评分跌了,1968571
2,央视再批畸形吃播,1930706
3,周杰伦晒20年前旧照,1911433
4,结婚前发现未婚夫是亿万富翁,1755396
5,三岁男孩从泳池中救出溺水好友,1366412
6,吴彤回复范丞丞高仿号,1183891
7,字节跳动宣布正式起诉特朗普政府,685219
8,新冠疫苗只能以成本作为定价依据,654689
9,安倍连续在任日本首相天数将创纪录,622348
10,两名医学生跪地救人无效却遭恶评,614159
11,易烊千玺单手脱戒指,519407
12,水阡墨,459697
13,陕西四胞胎东北虎宝宝与游客见面,431705
14,美新冠患者出院后收到巨额账单,408974
15,Lady Gaga的签名,405313
16,杨幂白衣骑马路透,400499
17,13所军校录取通知书,333907
18,民警劝解留住男人的心要靠魅力,325877
19,美军胡德堡基地一名核生化专家失踪,325428
20,盒子蛋糕,322668
21,官方回应夫妻俩在洱海洗车,320483
22,吴昕 乘风破浪的碎碎念,317708
23,原来麻将是这样清洗的,312804
24,粤港澳大湾区海事机构签署合作协议,310036
25,家长该不该在孩子面前哭,308082
26,大妈把大卫当成菩萨拜,307082
27,原来长颈鹿是这样喝水的,303763
28,耶鲁大学教授警告返校学生,299878
29,詹姆斯季后赛胜场数超邓肯,298350
30,老板为什么不给你加薪,296575
31,美国大选前一日将有小行星接近地球,280391
32,罗琦JD 她说,274500
33,科比生日,238832
34,五眼联盟欲变六眼,234247
35,教师回应提离职被学校索赔42万,232272
36,高圆圆送李佳琦唢呐曲谱,211944
37,黄子韬晒和Ty合影,183537
38,男子称身份被冒用背上490万贷款,183261
39,仓鼠大逃亡,178599
40,说唱听我的,174662
41,夸人要夸细节,162724
42,大长腿滤镜下的央视主持人,156548
43,用Siri给猫起名字,152560
44,美军改装商务机抵近中国侦察,152336
45,以家人之名,152182
46,澳大利亚淘金客挖出两块黄金,132392
47,CUBA,131361
48,湖人罚球命中率,130716
49,坠楼女生母亲称其患有抑郁症,129853
50,TFBOYS演唱会单人机位,129775
