,标题,热度
0,嫦娥四号进入第21月昼工作期,0
1,周震南 不是所有的猫都很温顺,2959151
2,中国专家发现阿尔茨海默病生物标志物,1157004
3,获救男孩妈妈向救命恩马致歉,853426
4,武汉卫健委辟谣有患者新冠复阳,852030
5,冯绍峰 这两天减下来了没人拍了,829823
6,谢娜直播,827989
7,武汉江汉方舱医院彻底关了,819033
8,韩国多款婴儿哺乳枕被检出致癌物,796244
9,多家美国企业联手抵制特朗普封杀微信,795227
10,朴宰范,795086
11,猫主人回应高空坠猫砸晕老人,608250
12,唐灿好可爱,574968
13,孟美岐甩飞假发片,502546
14,澳大利亚用滞销啤酒发电,405314
15,天津一外籍人员在境外新冠检测阳性,393904
16,农民种出袁隆平钟南山稻田画,387908
17,天津市民自发悼念遇害女孩,384317
18,20户商家联名举报饿了么,379675
19,美国手机近七成中国制造,371775
20,河南大爷收藏两千多种药品说明书,365042
21,夫妻闯义乌做直播带货半月赔5万,364068
22,吴宣仪像极了考试的我,357055
23,四川云瀑,350359
24,女游客接二连三推倒告示牌,347675
25,齐明月看凌霄的眼神,345451
26,小鬼背驾照考试题,337821
27,孙颖莎夺得女单冠军,317019
28,学生骑电动车闯红灯被撞飞负全责,304860
29,阿联酋将与以色列实现关系全面正常化,282091
30,朱一龙催更重启,270604
31,鲍毓明案当事女孩疑有两张身份证,270540
32,鲍毓明发朋友圈称将开发布会,264547
33,张含韵李佳琦直播,257268
34,近7成受访美企对中国市场前景乐观,253092
35,贺子秋太难了,250481
36,司凤情人咒发作,240315
37,美国新冠肺炎超524万例,237244
38,迪士尼在逃生物,234643
39,世卫称全球需要多种类型疫苗,203442
40,白昊天真实身份,177244
41,世卫回应深圳进口冻鸡翅检出新冠,176308
42,少女的真心是钻石,167415
43,鹿晗台词,166086
44,程潇玻璃倒影,160750
45,新手驾到,138965
46,庐山枧洼水库桃花水母,136558
47,检察院提前介入山砀镇杀人案,135925
48,美国今年已有424家公司破产,124653
49,杜锋,114249
50,鞍山警方30万悬赏刑案嫌疑人,113930
