,标题,热度
0,光盘挑战大赛,0
1,冯绍峰 这两天减下来了没人拍了,1289537
2,中国专家发现阿尔茨海默病生物标志物,1115018
3,终结选择困难症,1114346
4,周震南 不是所有的猫都很温顺,1114121
5,朴宰范,1066663
6,流传中的永恒,910645
7,小红书崩了,874047
8,唐灿好可爱,602488
9,天津一外籍人员在境外新冠检测阳性,419596
10,多家美国企业联手抵制特朗普封杀微信,371729
11,猫主人回应高空坠猫砸晕老人,369798
12,孟美岐甩飞假发片,358574
13,齐明月看凌霄的眼神,357115
14,贺子秋太难了,345667
15,低风险地区中小学生校园内无需戴口罩,344638
16,杜锋,343923
17,农民种出袁隆平钟南山稻田画,326972
18,吴宣仪像极了考试的我,312174
19,美国手机近七成中国制造,304449
20,学生骑电动车闯红灯被撞飞负全责,279703
21,夫妻闯义乌做直播带货半月赔5万,273621
22,女游客接二连三推倒告示牌,272357
23,小鬼背驾照考试题,266984
24,韩国多款婴儿哺乳枕被检出致癌物,247593
25,近7成受访美企对中国市场前景乐观,242670
26,飘飘人设,242602
27,张含韵李佳琦直播,241972
28,朱一龙催更重启,241059
29,美国今年已有424家公司破产,234533
30,西安进口白虾包装部分样本新冠阳性,226833
31,少女的真心是钻石,223959
32,鲍毓明发朋友圈称将开发布会,221075
33,新手驾到,214708
34,白昊天真实身份,208462
35,特朗普称哈里斯和拜登都是社会主义者,208461
36,马布里毒奶,208460
37,鹿晗台词,200980
38,程潇玻璃倒影,200365
39,迪士尼停用所有二十世纪福克斯品牌,194865
40,迪士尼在逃生物,179747
41,重启第一季大结局,172547
42,司凤情人咒发作,170953
43,阿里巴巴注册新公司京西,149934
44,神盾局特工第七季完结,149266
45,检察院提前介入山砀镇杀人案,132457
46,和蔡徐坤握手的表情,128824
47,贝壳集团上市,128787
48,上海警方抓获29年前5死凶案嫌疑人,113530
49,记录头发是怎么没的,98226
50,中饭协发文倡议开发小份菜和套餐,70482
