,标题,热度
0,京城24小时,0
1,李佳琦道歉,3894793
2,钟南山呼吁新冠救治要更重视心理健康,3137284
3,阿玛尼大女主香,3123676
4,郑爽情绪,2683655
5,于正说给宋威龙谈了一个大饼,1963211
6,向往的宅生活,1364078
7,乐山再通报刺激性气味,1012206
8,牵狗女孩想向老人家属道歉,802607
9,解放军和武警部队120多万人次抗洪,640845
10,首尔房价暴涨52%,593248
11,全球已有超8万个新冠病毒基因序列,587823
12,赵丽颖林大厨沟通后厨采购,531618
13,以家人之名剧情发展,379365
14,美国今年近2.7万人因枪死亡,334382
15,世卫希望两年之内结束新冠大流行,294938
16,北方又一轮较强降水来袭,287641
17,李健还会说多少成语,284669
18,特朗普政府或允许美企在中国使用微信,279420
19,省考,278351
20,行测,270428
21,没想到鹿打架这么认真,266208
22,胧月原作者为金莎发声,262697
23,张公案,260306
24,花百万建水上乐园村书记回应质疑,254161
25,今年上半年美国新增超200万持枪者,251797
26,胧月,233483
27,猫妹妹,229051
28,张雨绮 抱你到天亮mua,228073
29,三大运营商半年报显示5G推进超预期,224607
30,沈阳暴雨近千年古塔外墙被冲倒,220793
31,旅美大熊猫美香产下幼崽,219294
32,杨洋 我又倒模了,219094
33,郑爽直播,219089
34,上海新增13例境外输入,218838
35,张鑫的出轨对象是谁,187103
36,塞维利亚夺得欧联冠军,176442
37,陈学冬碟中谍,173036
38,孟非发文报平安,168756
39,美国批准首个透明手术口罩,153939
40,中餐厅,143073
41,抱摔幼童视频拍摄者为孩子母亲,139246
42,王鹤棣的西瓜头太真了,139222
43,李宇春唱歌时李荣浩的表情,139207
44,雅诗兰黛全球将裁员近两千人,139188
45,元气满满的哥哥,136669
46,瘦其实是一种天赋,130177
47,信条,128984
48,璇玑误会司凤,123980
49,女童被教师殴打致精神残疾重审开庭,114330
50,中国平均丧葬费用约37375元,101737
