,标题,热度
0,最美天空PK赛,0
1,郭敬明上楼了,3405417
2,100多名中国乘客滞留美国,1649918
3,明星云集的直播基地,1376270
4,特朗普计划在白宫为弟弟举行葬礼,1335380
5,金智秀雪滴花,1231424
6,秦昊通宵打拳,1009371
7,初中生把西游记画成81难通关图,970185
8,沈阳一门市发生爆炸,883116
9,中央气象台发布暴雨黄色预警,685805
10,微信朋友圈可以删评论了,650322
11,蒙古国为什么捐赠3万只羊,648936
12,中铁建集团董事长陈奋健坠亡,636356
13,以家人之名,391848
14,商务部对澳进口葡萄酒反倾销调查,391459
15,青衣江雅安段现百年一遇洪水,391175
16,仝卓事件被写入公职人员学习读本,390965
17,上海新增14例境外输入,390448
18,太阳为权志龙庆生,389929
19,股市,389852
20,NBA季后赛,389185
21,王者荣耀神秘商店,388752
22,易烊千玺世赛推广大使,388366
23,407岁梨树被烧空心仍能结果,388338
24,漂流为啥带个盆,361789
25,马斯克成全球第四大富豪,337656
26,山东宁阳县一只蛐蛐卖了11万,314114
27,年轻人辞职需不需要冷静期,310603
28,菲律宾发生6.6级地震,204619
29,刘敏涛范丞丞红玫瑰ending,193817
30,海南打掉离岛免税商品套购团伙9个,189945
31,反对食品浪费将列入旅游景区标准,188350
32,青青子衿,183020
33,贺子秋洗澡,180417
34,哈利波特重映票房过亿,167794
35,原来汉堡还可以这样吃,159287
36,美国新冠肺炎确诊超542万例,149879
37,24岁抗洪牺牲消防员赵丹被评烈士,140925
38,新疆新增确诊病例0例,137796
39,鹿晗演技,136454
40,四川启动一级防汛应急响应,130057
41,郑秀晶与SM解约,127930
42,齐明月暗恋凌霄,114109
43,肖战直播,110493
44,孟晚舟引渡案17日法庭听证结束,103641
45,张艺兴 人间节拍器,103122
46,琉璃预告,98670
47,爸妈眼里的随手关门,97644
48,用碳粉作画还原市井生活,95759
49,双胞胎兄弟被录取为空军和海军,93430
50,美国新冠肺炎死亡超17万例,93109
