,标题,热度
0,驻黎巴嫩大使馆提醒中国公民注意安全,0
1,林更新,5892815
2,南京遇害女生男友曾一起去报案,3709109
3,快递柜取件码安全性存疑,1807184
4,浙二眼科,1799830
5,鹿晗演技,1653605
6,少女时代合体,1439481
7,巴西副总统欢迎华为参与本国5G竞标,1295961
8,华为年薪201万天才少年回应,1266492
9,10万余箱问题坚果流入市场,1251590
10,林有有 工具人,1243258
11,父亲第一条朋友圈献给女儿,1171736
12,德阳安医生自杀案今日开庭,1143284
13,张萌录视频道歉,1080196
14,独居老人家中摔倒4天靠敲盆获救,936705
15,爆炸目击者说整座城下起碎玻璃雨,706148
16,李宇春像极了上课怕被点名的我,692948
17,硝酸铵是什么,672546
18,黎巴嫩总理证实2700吨硝酸铵爆炸,650868
19,浙江省教育考试院回应满分作文,607542
20,游客被洪水冲走瞬间消防员一把抓住,593077
21,刘雨昕再唱想见你,540096
22,杭州天气,466867
23,长影著名导演姜树森去世,465042
24,苹果更新27寸iMac,404158
25,央视评男教师10年猥亵20多名男生,404014
26,李宇春腾格尔党妹跨次元尴尬,403289
27,黎巴嫩首都突发爆炸,401787
28,台风过后男子家中下水道喷垃圾,394147
29,股市,386700
30,北京市民可随手拍举报交通违法行为,379715
31,花木兰放弃北美院线发行,364029
32,26年前张玉环故意杀人案6大疑点,352098
33,贝鲁特市长接受采访时痛哭,351982
34,粤港澳大湾区城际铁路建设规划获批,339726
35,南昌大学学霸寝室集体保研名校,339410
36,千万不要让家人学会拍一拍,309756
37,大连下架封存凯洋海鲜公司涉疫产品,265833
38,暂无中国公民在爆炸中死亡,263478
39,新冠疫情影响全球超10亿学生,258560
40,汤显祖的千层套路,250409
41,广东湛江20公里银滩变黑滩,212953
42,黎巴嫩疫苗和药物仓库位于爆炸港口,212653
43,英雄联盟灵能特工皮肤,212354
44,大学生制作高校土味宣传片,211955
45,尹正为王一博庆生,211486
46,闺蜜拍照技术到底有多差,210683
47,作者回应带女儿穿越回我爱我家,210338
48,楚歌哭戏,210176
49,大坪医院,209791
50,上海暴雨,206714
