,标题,热度
0,为公益慷慨出手的侠之大者,0
1,张月李泽锋微博评论,3733064
2,石家庄最大烂尾楼盘成网红拍照圣地,1936112
3,王一博大型真香现场,1920750
4,吴彦祖近照,1902716
5,张一山,1877256
6,大理洱海现龙吸水,1087155
7,南京遇害女生男友曾一起去报案,927062
8,中国赴黎巴嫩维和部队待命救援,898422
9,美军发射一枚民兵3洲际导弹,874300
10,10万余箱问题坚果流入市场,871331
11,浙二眼科,870540
12,邓伦 人生难得窝囊,853123
13,为暗恋的人做哈利波特攻略,694785
14,一中国公民黎巴嫩爆炸中受轻伤,694663
15,导致爆炸的2750吨硝酸铵堆放了6年,533319
16,作者回应带女儿穿越回我爱我家,403967
17,陈辰生女,401605
18,075,396871
19,爷爷打着手电给孙女看报考资料,389479
20,深圳地铁方面回应童言广告语,383865
21,自制火鸡面辣条,378088
22,鹿晗连续6天拍打戏中暑,377861
23,深圳一号线女性车厢标语,362656
24,黎巴嫩首都爆炸死亡人数已超100人,352175
25,硝酸铵是什么,344555
26,央视评男教师10年猥亵20多名男生,275395
27,TFBOYS粉丝猜对新歌歌名,268177
28,赵薇仙气朦胧大片,258089
29,巴西副总统欢迎华为参与本国5G竞标,252975
30,华为年薪201万天才少年回应,237722
31,杭州新增1例无症状感染者,231799
32,冯远征拟任北京人艺副院长,227523
33,江疏影谈王漫妮留学,220022
34,德阳安医生自杀案今日开庭,210170
35,凭实力招恨的影视角色,190935
36,独居老人家中摔倒4天靠敲盆获救,184435
37,郑爽港风造型,183813
38,TFBOYS新歌预告,181674
39,父亲第一条朋友圈献给女儿,176009
40,外交部回应美卫生部长将率团访台,164245
41,杭州排查新增无症状感染者活动轨迹,160478
42,李宇春像极了上课怕被点名的我,158108
43,快递柜取件码安全性存疑,152270
44,游客被洪水冲走瞬间消防员一把抓住,134772
45,广东湛江20公里银滩变黑滩,128614
46,刘雨昕再唱想见你,123864
47,江南百景图金画轴抽卡,123010
48,苹果更新27寸iMac,118569
49,擅摘并蒂莲者被纳入不文明行为记录,108903
50,英雄联盟灵能特工皮肤,108344
