,标题,热度
0,你好新同学,0
1,谭松韵妈妈被撞案将开庭,5316082
2,一片优质卫生巾成本约3毛钱,1451327
3,虚拟Idol掰头乐夏10强,1413347
4,快乐大本营,1360898
5,吴奇隆回应被保安按倒,1266632
6,独门舞技大赏,1195561
7,这些竟然都是蛋糕做出来的,1174331
8,王俊凯祝谢霆锋菜园子无坚不摧,1112688
9,可口可乐将在北美裁员4000人,729701
10,赵立坚回应安倍晋三宣布辞职,729001
11,百花奖提名名单,728358
12,琉璃,708659
13,小伙不恰当健身或引起脱发,553643
14,无腿中介带客户看房日行2万步,533432
15,永州被踹伤猥亵男主治医生回应,416506
16,TheShy的凯南,386388
17,金莎 80后我不考虑的有代沟,379048
18,山西坍塌饭店已救出43人,377308
19,教育局回应小学女教师两个月升副校长,374233
20,GAP预计今年净关闭225家门店,372155
21,吴亦凡遛鹅,369699
22,每次回家都像密室逃脱,367348
23,这就是街舞,363340
24,金晨 来这个节目就是让大家看到我,362994
25,免费为抗疫人员送餐夫妇妻子被烧伤,351735
26,当代年轻人的睡眠,350607
27,好声音导师最尴尬的瞬间,345187
28,山西临汾一饭店坍塌已有17人遇难,334606
29,建行数字人民币钱包已上线,328702
30,安倍经济学8年回顾,328655
31,明日之子,328611
32,博斯曼在结肠癌三期拍了好几部电影,322917
33,金晨流水账式决赛vlog,297573
34,李宇春用一个眼神把人抢了,270105
35,中央第七次西藏工作座谈会,250162
36,大学食堂推出1毛钱米饭,231066
37,陕西救人溺亡副局长妻子发声,223454
38,古装剧中的绝美嫁衣,204495
39,将演员动作线条化,194661
40,漫威回应黑豹男主去世,188584
41,刘昊然百花奖形象大使,184122
42,朋友帮买东西该不该加钱,182194
43,iG FPX,177492
44,凌霄的肩膀是陈婷烫伤的,167710
45,云南普洱山的星空云海,167528
46,最努力营业的熊猫,166657
47,乐队的夏天,163744
48,没想到面试也能玩梗,160276
49,数名小孩在30多层楼顶追逐打闹,154096
50,解放军一个月至少九场大型军演,149732
